{
  "$schema": "../../../../schema/project.schema.json",
  "schemaType": "nansen.project",
  "schemaVersion": "0.1.0",
  "name": "TwoPhotonPilot",
  "title": "Two-photon pilot",
  "entityTypes": [
    {
      "name": "subject"
    },
    {
      "name": "session",
      "fragments": [
        "notes",
        "ophys.qc"
      ]
    }
  ]
}
